{
  "schemaVersion": "0.2.0",
  "provider": "example-provider",
  "operation": "push",
  "executionContext": {
    "runtime": "host",
    "runtimeIdentifier": null,
    "platform": null,
    "isolation": null
  },
  "status": "unavailable",
  "capabilities": [],
  "availableCredentialSources": [],
  "selectedCredentialSource": null,
  "identity": null,
  "network": null,
  "diagnosis": {
    "code": "CREDENTIAL_NOT_FOUND",
    "conclusive": true,
    "summary": "No currently usable credential path was discovered in this execution context."
  },
  "recommendedResolution": {
    "strategy": "MANUAL_REVIEW",
    "steps": ["configure a credential source", "re-diagnose"],
    "actionRequired": true
  },
  "reauthRequired": false,
  "evidence": [
    { "probeType": "credential-source", "check": "source.enumeration", "outcome": "failure", "code": "CREDENTIAL_NOT_FOUND", "summary": "No credential source found" }
  ]
}